{
  "schemaVersion": 1,
  "workId": "ci-default-branch-resolution",
  "kind": "FRAMEWORK",
  "branch": "codex/fix-ci-default-branch-resolution",
  "base": {
    "branch": "main",
    "sha": "e0b3ca1c3b17578b488e59f7bd36dfb6c7873ea1"
  },
  "requestPath": ".ai-sdlc/work/ci-default-branch-resolution/request.md",
  "specPath": ".ai-sdlc/work/ci-default-branch-resolution/spec.md",
  "confirmed": {
    "source": "human:chat-2026-08-22",
    "at": "2026-08-22T07:52:51.922Z",
    "specSha256": "d268175c29196025086c44b9fd8e574dd70ecde0f6eaa68efc2de78ab73e3bb2"
  },
  "freeze": {
    "commitSha": "8638504888b210279bb183f237158040c7c3b6f3",
    "specSha256": "d268175c29196025086c44b9fd8e574dd70ecde0f6eaa68efc2de78ab73e3bb2",
    "at": "2026-08-22T07:52:52.165Z"
  },
  "mode": null,
  "changes": [],
  "createdAt": "2026-08-22T07:50:16.629Z"
}
